{
  "run_id": "84bb5e92-2f7f-470f-a375-9a71d4165a21",
  "status": "error",
  "submitted_by": "operator",
  "submitted_at": "2026-08-24T18:52:51.196848Z",
  "source_url": "https://www.straitstimes.com/world/middle-east/pakistan-says-us-and-iran-close-to-some-sort-of-deal-despite-attacks-on-shipping"
}
