{
  "run_id": "ff610b10-482b-417c-8ad5-405741161525",
  "status": "complete",
  "submitted_by": "operator",
  "submitted_at": "2026-08-24T19:17:33.318953Z",
  "source_url": "https://www.straitstimes.com/world/middle-east/pakistan-says-us-and-iran-close-to-some-sort-of-deal-despite-attacks-on-shipping",
  "event": {
    "relevant": true,
    "confidence": 0.95,
    "relevance_rationale": "The article details active maritime blockades, security threats, and direct attacks on cargo and container ships in critical global shipping channels (Strait of Hormuz, Bab el-Mandeb, Gulf of Oman, Red Sea), which directly impacts global trade routes and PSA-bound maritime shipping logistics.",
    "summary": "Iranian officials state the Strait of Hormuz will remain closed to shipping until the US meets its conditions. Concurrently, maritime security threats persist with reported attacks on commercial vessels in the Gulf of Oman and Bab el-Mandeb strait, including a fatal strike on a cargo vessel and a missile strike on a container ship.",
    "entities": {
      "location": "Middle East",
      "event_type": "Maritime Blockade & Vessel Attacks",
      "date": "2025-08-11",
      "actors": [
        "Iran's Supreme National Security Council",
        "US Military",
        "Houthis",
        "Yemen Transport Ministry"
      ],
      "chokepoints_mentioned": [
        "Strait of Hormuz",
        "Bab el-Mandeb",
        "Red Sea",
        "Gulf of Oman"
      ]
    },
    "evidence": [
      "The Strait of Hormuz will remain closed as long as the US does not change its behaviour and accept Iran\u2019s conditions to end the war",
      "Adding to the rhetoric from both sides were reports of new attacks on shipping in the Gulf of Oman and the Red Sea, highlighting the threat to maritime trade.",
      "A container ship was also hit by a missile off Pakistan while sailing through the Gulf of Oman, in a suspected US attack, sources said."
    ],
    "run_id": "ff610b10-482b-417c-8ad5-405741161525",
    "source_url": "https://www.straitstimes.com/world/middle-east/pakistan-says-us-and-iran-close-to-some-sort-of-deal-despite-attacks-on-shipping",
    "extracted_at": "2026-08-24T19:17:40.249587Z"
  },
  "risk_assessment": {
    "severity": "Critical",
    "confidence": 0.9,
    "probability": 0.95,
    "affected_chokepoints": [
      "Strait of Hormuz",
      "Bab el-Mandeb",
      "Red Sea",
      "Gulf of Oman"
    ],
    "estimated_duration": "Ongoing pending political negotiations",
    "rationale": "Active closures of the Strait of Hormuz combined with missile strikes on commercial vessels in the Gulf of Oman and Red Sea represent an immediate, severe disruption to major maritime trade corridors.",
    "evidence": [
      "The Strait of Hormuz will remain closed as long as the US does not change its behaviour and accept Iran\u2019s conditions to end the war",
      "Adding to the rhetoric from both sides were reports of new attacks on shipping in the Gulf of Oman and the Red Sea, highlighting the threat to maritime trade.",
      "A container ship was also hit by a missile off Pakistan while sailing through the Gulf of Oman, in a suspected US attack, sources said."
    ],
    "run_id": "ff610b10-482b-417c-8ad5-405741161525"
  },
  "candidate_routes": [
    {
      "run_id": "ff610b10-482b-417c-8ad5-405741161525",
      "route_id": "RT-001-BASELINE",
      "retrieved_reason": "Baseline route retained for comparison."
    },
    {
      "run_id": "ff610b10-482b-417c-8ad5-405741161525",
      "route_id": "RT-002-FUJAIRAH-BYPASS",
      "retrieved_reason": "Avoids affected chokepoints."
    }
  ],
  "ranked_routes": [
    {
      "run_id": "ff610b10-482b-417c-8ad5-405741161525",
      "route_id": "RT-002-FUJAIRAH-BYPASS",
      "rank": 1,
      "score": 0.88,
      "eta": "2026-09-06T16:26:26.878600Z",
      "eta_delta_days": 2,
      "rationale": "Balances chokepoint exposure and transit time."
    },
    {
      "run_id": "ff610b10-482b-417c-8ad5-405741161525",
      "route_id": "RT-001-BASELINE",
      "rank": 2,
      "score": 0.65,
      "eta": "2026-09-04T16:26:26.878600Z",
      "eta_delta_days": 0,
      "rationale": "Balances chokepoint exposure and transit time."
    }
  ],
  "advisory": {
    "run_id": "ff610b10-482b-417c-8ad5-405741161525",
    "headline": "Prepare for possible Strait of Hormuz delay",
    "summary": "Strait of Hormuz tension may delay the vessel by several days.",
    "recommended_actions": [
      "Flag berth slot for possible delay",
      "Notify transshipment partners"
    ],
    "confidence": 0.85,
    "operator_decision": "pending",
    "operator_comment": null
  }
}
